{
  "$schema": "../../../CARRIER/SCHEMAS/matter-index.schema.json",
  "schema": "local-reality-body.matter-index.v0.1",
  "body_id": "RM-LOCAL-REALITY-BODY-001",
  "represented_currentness_revision": 7,
  "records": [],
  "record_count": 0,
  "explicit_non_effects": [
    "NO_MATTER_ADMISSION_BY_INDEX_EXISTENCE",
    "NO_EXTERNAL_SOURCE_IMPORT",
    "NO_TRUTH_OR_STANDING_BY_RECEIPT",
    "NO_AUTHORITY_OR_ACTION_BY_URGENCY",
    "NO_WORKSPACE_OR_CORPUS_ADMISSION"
  ]
}
